{
  "schemaVersion": 1,
  "projectKey": "fi_public_m1demo001",
  "sentAt": "2026-07-19T19:02:10.000Z",
  "sdk": { "name": "web-tracker", "version": "0.1.0" },
  "events": [
    {
      "eventId": "evt_long_view_page_001",
      "eventName": "page_view",
      "eventTime": "2026-07-19T19:00:00.000Z",
      "visitorId": "vis_long_view_001",
      "sessionId": "ses_long_view_001",
      "pageViewId": "pv_long_view_001",
      "accountRef": "opaque-account-003",
      "route": "/wallboards/operations",
      "properties": {}
    },
    {
      "eventId": "evt_long_view_exposed_001",
      "eventName": "feature_exposed",
      "eventTime": "2026-07-19T19:00:00.200Z",
      "visitorId": "vis_long_view_001",
      "sessionId": "ses_long_view_001",
      "pageViewId": "pv_long_view_001",
      "accountRef": "opaque-account-003",
      "route": "/wallboards/operations",
      "featureKey": "operations_wallboard",
      "properties": {}
    },
    {
      "eventId": "evt_long_view_started_001",
      "eventName": "feature_long_view_started",
      "eventTime": "2026-07-19T19:00:00.300Z",
      "visitorId": "vis_long_view_001",
      "sessionId": "ses_long_view_001",
      "pageViewId": "pv_long_view_001",
      "accountRef": "opaque-account-003",
      "route": "/wallboards/operations",
      "featureKey": "operations_wallboard",
      "properties": {}
    },
    {
      "eventId": "evt_long_view_success_001",
      "eventName": "feature_succeeded",
      "eventTime": "2026-07-19T19:00:30.300Z",
      "visitorId": "vis_long_view_001",
      "sessionId": "ses_long_view_001",
      "pageViewId": "pv_long_view_001",
      "accountRef": "opaque-account-003",
      "route": "/wallboards/operations",
      "featureKey": "operations_wallboard",
      "properties": { "visibleDurationMs": 30000 }
    },
    {
      "eventId": "evt_long_view_heartbeat_001",
      "eventName": "feature_long_view_heartbeat",
      "eventTime": "2026-07-19T19:01:00.300Z",
      "visitorId": "vis_long_view_001",
      "sessionId": "ses_long_view_001",
      "pageViewId": "pv_long_view_001",
      "accountRef": "opaque-account-003",
      "route": "/wallboards/operations",
      "featureKey": "operations_wallboard",
      "properties": { "visibleDurationMs": 60000 }
    },
    {
      "eventId": "evt_long_view_ended_001",
      "eventName": "feature_long_view_ended",
      "eventTime": "2026-07-19T19:02:00.300Z",
      "visitorId": "vis_long_view_001",
      "sessionId": "ses_long_view_001",
      "pageViewId": "pv_long_view_001",
      "accountRef": "opaque-account-003",
      "route": "/wallboards/operations",
      "featureKey": "operations_wallboard",
      "properties": { "visibleDurationMs": 120000 }
    }
  ]
}
